<?xml version="1.0" encoding="UTF-8"?>

<!--
    Document   : visualizers.xsd
    Created on : June 16, 2005, 5:08 PM
    Author     : gaffneyc
    Description:
        Purpose of XML Schema document follows.
-->

<xsd:schema xmlns:xsd="http://www.w3.org/2001/XMLSchema"
            xmlns:ns="http://csf11.acs.uwosh.edu/jhave">

    <xsd:element name="visualizers" type="VisualizerList"/>
    
    <xsd:complexType name="VisualizerList">
        <xsd:sequence>
            <xsd:element name="visualizer" type="VisualizerType" minOccurs="1" maxOccurs="unbounded"/>
        </xsd:sequence>
    </xsd:complexType>

    <xsd:complexType name="VisualizerType">
        <xsd:sequence>
            <xsd:element name="class" type="SimpleValue" minOccurs="1" maxOccurs="1"/>
            <xsd:element name="extension" type="SimpleValue" minOccurs="1" maxOccurs="unbounded"/>
        </xsd:sequence>
        <xsd:attribute name="name" type="xsd:string" use="required"/>
    </xsd:complexType>

    <xsd:complexType name="SimpleValue">
        <xsd:attribute name="value" type="xsd:string" use="required"/>
    </xsd:complexType>
</xsd:schema>
